[
    {
        "month": 4,
        "day": 23,
        "event_key": "StAdalbert",
        "grade": 2,
        "grade_display": null,
        "common": [
            "Martyrs:For One Martyr",
            "Pastors:For a Bishop"
        ],
        "calendar": "IT",
        "color": [
            "white",
            "red"
        ]
    },
    {
        "month": 4,
        "day": 28,
        "event_key": "StLouisGrignionMontfort",
        "grade": 2,
        "grade_display": null,
        "common": [
            "Pastors:For One Pastor"
        ],
        "calendar": "IT",
        "color": [
            "white"
        ]
    },
    {
        "month": 8,
        "day": 2,
        "event_key": "StPeterJulianEymard",
        "grade": 2,
        "grade_display": null,
        "common": [
            "Pastors:For One Pastor",
            "Holy Men and Women:For Religious"
        ],
        "calendar": "IT",
        "color": [
            "white"
        ]
    },
    {
        "month": 8,
        "day": 14,
        "event_key": "StMaximilianKolbe",
        "grade": 3,
        "grade_display": null,
        "common": [
            "Proper"
        ],
        "calendar": "IT",
        "color": [
            "white",
            "red"
        ]
    },
    {
        "month": 9,
        "day": 9,
        "event_key": "StPeterClaver",
        "grade": 2,
        "grade_display": null,
        "common": [
            "Pastors:For One Pastor",
            "Holy Men and Women:For Those Who Practiced Works of Mercy"
        ],
        "calendar": "IT",
        "color": [
            "white"
        ]
    },
    {
        "month": 9,
        "day": 20,
        "event_key": "StAndrewKimTaegon",
        "grade": 3,
        "grade_display": null,
        "common": [
            "Proper"
        ],
        "calendar": "IT",
        "color": [
            "white"
        ]
    },
    {
        "month": 9,
        "day": 28,
        "event_key": "StsLawrenceRuiz",
        "grade": 2,
        "grade_display": null,
        "common": [
            "Martyrs:For Several Martyrs"
        ],
        "calendar": "IT",
        "color": [
            "red"
        ]
    },
    {
        "month": 11,
        "day": 24,
        "event_key": "StAndrewDungLac",
        "grade": 3,
        "grade_display": null,
        "common": [
            "Proper"
        ],
        "calendar": "IT",
        "color": [
            "red"
        ]
    }
]
